{
  "version": "1.1",
  "timestamp": "2026-06-29T00:55:57.123Z",
  "environment": {
    "node": "v24.18.0",
    "platform": "linux",
    "arch": "x64"
  },
  "config": {
    "iterations": 100,
    "timeoutMs": 120000
  },
  "results": [
    {
      "provider": "fcspawn",
      "iterations": [
        {
          "ttiMs": 999.63
        },
        {
          "ttiMs": 302.46
        },
        {
          "ttiMs": 283.31
        },
        {
          "ttiMs": 313.21
        },
        {
          "ttiMs": 284.41
        },
        {
          "ttiMs": 289.27
        },
        {
          "ttiMs": 476.37
        },
        {
          "ttiMs": 283.25
        },
        {
          "ttiMs": 294.07
        },
        {
          "ttiMs": 277.11
        },
        {
          "ttiMs": 302
        },
        {
          "ttiMs": 293.9
        },
        {
          "ttiMs": 273.12
        },
        {
          "ttiMs": 374.79
        },
        {
          "ttiMs": 276.36
        },
        {
          "ttiMs": 304.58
        },
        {
          "ttiMs": 284.79
        },
        {
          "ttiMs": 297.98
        },
        {
          "ttiMs": 415.23
        },
        {
          "ttiMs": 278.8
        },
        {
          "ttiMs": 284.29
        },
        {
          "ttiMs": 283.02
        },
        {
          "ttiMs": 301.04
        },
        {
          "ttiMs": 282.08
        },
        {
          "ttiMs": 285.35
        },
        {
          "ttiMs": 422.04
        },
        {
          "ttiMs": 275.98
        },
        {
          "ttiMs": 286.54
        },
        {
          "ttiMs": 283.79
        },
        {
          "ttiMs": 299.21
        },
        {
          "ttiMs": 369.51
        },
        {
          "ttiMs": 286.39
        },
        {
          "ttiMs": 303.48
        },
        {
          "ttiMs": 278.72
        },
        {
          "ttiMs": 303.4
        },
        {
          "ttiMs": 281.99
        },
        {
          "ttiMs": 299.5
        },
        {
          "ttiMs": 306.64
        },
        {
          "ttiMs": 273.7
        },
        {
          "ttiMs": 286.9
        },
        {
          "ttiMs": 473.76
        },
        {
          "ttiMs": 270.54
        },
        {
          "ttiMs": 287.67
        },
        {
          "ttiMs": 286.66
        },
        {
          "ttiMs": 301.99
        },
        {
          "ttiMs": 266.96
        },
        {
          "ttiMs": 283.43
        },
        {
          "ttiMs": 423.74
        },
        {
          "ttiMs": 320.87
        },
        {
          "ttiMs": 291.71
        },
        {
          "ttiMs": 273.01
        },
        {
          "ttiMs": 317.59
        },
        {
          "ttiMs": 282.37
        },
        {
          "ttiMs": 285.27
        },
        {
          "ttiMs": 315.48
        },
        {
          "ttiMs": 318.91
        },
        {
          "ttiMs": 283.08
        },
        {
          "ttiMs": 426.55
        },
        {
          "ttiMs": 291.06
        },
        {
          "ttiMs": 288.5
        },
        {
          "ttiMs": 276.42
        },
        {
          "ttiMs": 302.83
        },
        {
          "ttiMs": 288.42
        },
        {
          "ttiMs": 289.2
        },
        {
          "ttiMs": 410.36
        },
        {
          "ttiMs": 288.12
        },
        {
          "ttiMs": 275.95
        },
        {
          "ttiMs": 294.14
        },
        {
          "ttiMs": 300.73
        },
        {
          "ttiMs": 275.91
        },
        {
          "ttiMs": 268.37
        },
        {
          "ttiMs": 301.13
        },
        {
          "ttiMs": 280.65
        },
        {
          "ttiMs": 281.29
        },
        {
          "ttiMs": 422.27
        },
        {
          "ttiMs": 287.6
        },
        {
          "ttiMs": 281.23
        },
        {
          "ttiMs": 282.29
        },
        {
          "ttiMs": 310.67
        },
        {
          "ttiMs": 368.05
        },
        {
          "ttiMs": 268.31
        },
        {
          "ttiMs": 278.28
        },
        {
          "ttiMs": 296.6
        },
        {
          "ttiMs": 300.74
        },
        {
          "ttiMs": 276.2
        },
        {
          "ttiMs": 286.88
        },
        {
          "ttiMs": 467.9
        },
        {
          "ttiMs": 280.25
        },
        {
          "ttiMs": 280.44
        },
        {
          "ttiMs": 279.79
        },
        {
          "ttiMs": 299.77
        },
        {
          "ttiMs": 313.74
        },
        {
          "ttiMs": 286.6
        },
        {
          "ttiMs": 308.76
        },
        {
          "ttiMs": 279.12
        },
        {
          "ttiMs": 271.97
        },
        {
          "ttiMs": 414.99
        },
        {
          "ttiMs": 282.21
        },
        {
          "ttiMs": 280.12
        },
        {
          "ttiMs": 299.27
        }
      ],
      "summary": {
        "ttiMs": {
          "median": 287.89,
          "p95": 414.99,
          "p99": 423.74
        }
      },
      "compositeScore": 96.6,
      "successRate": 1
    }
  ]
}