{
  "version": "1.1",
  "timestamp": "2026-06-16T01:05:43.320Z",
  "environment": {
    "node": "v24.16.0",
    "platform": "linux",
    "arch": "x64"
  },
  "config": {
    "iterations": 100,
    "timeoutMs": 120000
  },
  "results": [
    {
      "provider": "fcspawn",
      "mode": "concurrent",
      "concurrency": 100,
      "wallClockMs": 4271.32,
      "timeToFirstReadyMs": 301.99,
      "iterations": [
        {
          "ttiMs": 301.99
        },
        {
          "ttiMs": 331.07
        },
        {
          "ttiMs": 412.24
        },
        {
          "ttiMs": 399.69
        },
        {
          "ttiMs": 655.35
        },
        {
          "ttiMs": 580.68
        },
        {
          "ttiMs": 613.82
        },
        {
          "ttiMs": 682.87
        },
        {
          "ttiMs": 685.95
        },
        {
          "ttiMs": 786.26
        },
        {
          "ttiMs": 1012.91
        },
        {
          "ttiMs": 976.49
        },
        {
          "ttiMs": 988.9
        },
        {
          "ttiMs": 991.63
        },
        {
          "ttiMs": 1214.71
        },
        {
          "ttiMs": 1169.31
        },
        {
          "ttiMs": 1263.75
        },
        {
          "ttiMs": 1224.76
        },
        {
          "ttiMs": 1308.94
        },
        {
          "ttiMs": 1311.55
        },
        {
          "ttiMs": 1571.12
        },
        {
          "ttiMs": 1450.73
        },
        {
          "ttiMs": 1504.62
        },
        {
          "ttiMs": 1532.08
        },
        {
          "ttiMs": 1540.63
        },
        {
          "ttiMs": 1655.5
        },
        {
          "ttiMs": 1676.23
        },
        {
          "ttiMs": 1710.2
        },
        {
          "ttiMs": 1673.31
        },
        {
          "ttiMs": 1777.75
        },
        {
          "ttiMs": 1699.58
        },
        {
          "ttiMs": 1873.73
        },
        {
          "ttiMs": 1894.97
        },
        {
          "ttiMs": 1827.71
        },
        {
          "ttiMs": 1955.62
        },
        {
          "ttiMs": 1870.32
        },
        {
          "ttiMs": 2001.16
        },
        {
          "ttiMs": 1984.02
        },
        {
          "ttiMs": 1964.56
        },
        {
          "ttiMs": 2213.22
        },
        {
          "ttiMs": 2046.52
        },
        {
          "ttiMs": 2182.39
        },
        {
          "ttiMs": 2167.12
        },
        {
          "ttiMs": 2278.44
        },
        {
          "ttiMs": 2257.38
        },
        {
          "ttiMs": 2224.69
        },
        {
          "ttiMs": 2388.52
        },
        {
          "ttiMs": 2403.3
        },
        {
          "ttiMs": 2413.16
        },
        {
          "ttiMs": 2450.66
        },
        {
          "ttiMs": 2436.94
        },
        {
          "ttiMs": 2577.7
        },
        {
          "ttiMs": 2557.72
        },
        {
          "ttiMs": 2668.76
        },
        {
          "ttiMs": 2622.57
        },
        {
          "ttiMs": 2658.31
        },
        {
          "ttiMs": 2815.67
        },
        {
          "ttiMs": 2758.26
        },
        {
          "ttiMs": 2831.16
        },
        {
          "ttiMs": 2829.89
        },
        {
          "ttiMs": 2971.68
        },
        {
          "ttiMs": 2887.32
        },
        {
          "ttiMs": 3021.69
        },
        {
          "ttiMs": 3016.82
        },
        {
          "ttiMs": 3000.26
        },
        {
          "ttiMs": 3005.22
        },
        {
          "ttiMs": 3173.86
        },
        {
          "ttiMs": 3125.52
        },
        {
          "ttiMs": 3132.5
        },
        {
          "ttiMs": 3197.73
        },
        {
          "ttiMs": 3257.16
        },
        {
          "ttiMs": 3195.19
        },
        {
          "ttiMs": 3320.73
        },
        {
          "ttiMs": 3232.57
        },
        {
          "ttiMs": 3422.71
        },
        {
          "ttiMs": 3374.11
        },
        {
          "ttiMs": 3450.53
        },
        {
          "ttiMs": 3427.14
        },
        {
          "ttiMs": 3610.78
        },
        {
          "ttiMs": 3492.97
        },
        {
          "ttiMs": 3547.22
        },
        {
          "ttiMs": 3571.38
        },
        {
          "ttiMs": 3565.46
        },
        {
          "ttiMs": 3721.73
        },
        {
          "ttiMs": 3649.08
        },
        {
          "ttiMs": 3722.29
        },
        {
          "ttiMs": 3708.26
        },
        {
          "ttiMs": 3747.66
        },
        {
          "ttiMs": 3930.48
        },
        {
          "ttiMs": 3799.06
        },
        {
          "ttiMs": 3903.2
        },
        {
          "ttiMs": 3865.46
        },
        {
          "ttiMs": 3940.21
        },
        {
          "ttiMs": 4011.16
        },
        {
          "ttiMs": 4110.8
        },
        {
          "ttiMs": 4138.77
        },
        {
          "ttiMs": 4054.59
        },
        {
          "ttiMs": 4155.6
        },
        {
          "ttiMs": 4123.35
        },
        {
          "ttiMs": 4224.23
        }
      ],
      "summary": {
        "ttiMs": {
          "median": 2443.8,
          "p95": 3903.2,
          "p99": 4054.59
        }
      },
      "compositeScore": 69.5,
      "successRate": 1
    }
  ]
}