{
  "version": "1.1",
  "timestamp": "2026-05-01T00:50:02.687Z",
  "environment": {
    "node": "v24.15.0",
    "platform": "linux",
    "arch": "x64"
  },
  "config": {
    "iterations": 100,
    "timeoutMs": 120000
  },
  "results": [
    {
      "provider": "fcspawn",
      "mode": "concurrent",
      "concurrency": 100,
      "wallClockMs": 8395.14,
      "timeToFirstReadyMs": 387.13,
      "iterations": [
        {
          "ttiMs": 390.27
        },
        {
          "ttiMs": 409.8
        },
        {
          "ttiMs": 388.39
        },
        {
          "ttiMs": 387.13
        },
        {
          "ttiMs": 730.47
        },
        {
          "ttiMs": 554.31
        },
        {
          "ttiMs": 733.1
        },
        {
          "ttiMs": 747.38
        },
        {
          "ttiMs": 735.76
        },
        {
          "ttiMs": 764.1
        },
        {
          "ttiMs": 950.12
        },
        {
          "ttiMs": 968.29
        },
        {
          "ttiMs": 1081.16
        },
        {
          "ttiMs": 955.22
        },
        {
          "ttiMs": 1095.64
        },
        {
          "ttiMs": 1277.26
        },
        {
          "ttiMs": 1273.93
        },
        {
          "ttiMs": 1255.39
        },
        {
          "ttiMs": 1448.58
        },
        {
          "ttiMs": 1294.14
        },
        {
          "ttiMs": 1430.34
        },
        {
          "ttiMs": 1454.7
        },
        {
          "ttiMs": 1542.86
        },
        {
          "ttiMs": 1479.35
        },
        {
          "ttiMs": 1514.98
        },
        {
          "ttiMs": 1626.4
        },
        {
          "ttiMs": 1616.78
        },
        {
          "ttiMs": 1953.4
        },
        {
          "ttiMs": 1765.42
        },
        {
          "ttiMs": 1803.4
        },
        {
          "ttiMs": 1946.05
        },
        {
          "ttiMs": 1990.38
        },
        {
          "ttiMs": 1986.6
        },
        {
          "ttiMs": 2128.67
        },
        {
          "ttiMs": 2126.25
        },
        {
          "ttiMs": 2127.75
        },
        {
          "ttiMs": 2283.06
        },
        {
          "ttiMs": 2131.81
        },
        {
          "ttiMs": 2285.96
        },
        {
          "ttiMs": 2398.49
        },
        {
          "ttiMs": 2312.86
        },
        {
          "ttiMs": 2396.73
        },
        {
          "ttiMs": 2626.83
        },
        {
          "ttiMs": 2565.9
        },
        {
          "ttiMs": 2598.39
        },
        {
          "ttiMs": 2803.07
        },
        {
          "ttiMs": 2705.3
        },
        {
          "ttiMs": 2803.17
        },
        {
          "ttiMs": 2819.48
        },
        {
          "ttiMs": 2829.95
        },
        {
          "ttiMs": 2844.37
        },
        {
          "ttiMs": 2845.99
        },
        {
          "ttiMs": 2877.23
        },
        {
          "ttiMs": 3067.96
        },
        {
          "ttiMs": 3020.27
        },
        {
          "ttiMs": 3044.75
        },
        {
          "ttiMs": 3055.53
        },
        {
          "ttiMs": 3205.4
        },
        {
          "ttiMs": 3202.62
        },
        {
          "ttiMs": 3237.57
        },
        {
          "ttiMs": 3279.5
        },
        {
          "ttiMs": 3284.82
        },
        {
          "ttiMs": 3388.89
        },
        {
          "ttiMs": 3426.91
        },
        {
          "ttiMs": 3443.8
        },
        {
          "ttiMs": 3468.01
        },
        {
          "ttiMs": 3519.45
        },
        {
          "ttiMs": 0,
          "error": "create: agent not ready: timeout waiting for agent after 390 attempts (first dial=10.701269ms, last err=dial tcp 192.168.0.10:1024: i/o timeout @ 5.000543388s): context deadline exceeded"
        },
        {
          "ttiMs": 3572.88
        },
        {
          "ttiMs": 3538.73
        },
        {
          "ttiMs": 3649.78
        },
        {
          "ttiMs": 3607.67
        },
        {
          "ttiMs": 3743.55
        },
        {
          "ttiMs": 3728.79
        },
        {
          "ttiMs": 3788.37
        },
        {
          "ttiMs": 3853.12
        },
        {
          "ttiMs": 3914.09
        },
        {
          "ttiMs": 3878.3
        },
        {
          "ttiMs": 3963.87
        },
        {
          "ttiMs": 3964.45
        },
        {
          "ttiMs": 3994.19
        },
        {
          "ttiMs": 4079.34
        },
        {
          "ttiMs": 4045.07
        },
        {
          "ttiMs": 4081.09
        },
        {
          "ttiMs": 4168.15
        },
        {
          "ttiMs": 4126.77
        },
        {
          "ttiMs": 4204.29
        },
        {
          "ttiMs": 4206.52
        },
        {
          "ttiMs": 4252.91
        },
        {
          "ttiMs": 4288.25
        },
        {
          "ttiMs": 4340.74
        },
        {
          "ttiMs": 4308.33
        },
        {
          "ttiMs": 4385.31
        },
        {
          "ttiMs": 4564.04
        },
        {
          "ttiMs": 4541.91
        },
        {
          "ttiMs": 4580.6
        },
        {
          "ttiMs": 4578.05
        },
        {
          "ttiMs": 4776.48
        },
        {
          "ttiMs": 4790.99
        },
        {
          "ttiMs": 4790.34
        }
      ],
      "summary": {
        "ttiMs": {
          "median": 2829.95,
          "p95": 4340.74,
          "p99": 4578.05
        }
      },
      "compositeScore": 64.65,
      "successRate": 0.99
    }
  ]
}