{
  "version": "1.1",
  "timestamp": "2026-05-22T08:03:04.331Z",
  "environment": {
    "node": "v24.16.0",
    "platform": "linux",
    "arch": "x64"
  },
  "config": {
    "iterations": 100,
    "timeoutMs": 120000
  },
  "results": [
    {
      "provider": "fcspawn",
      "mode": "concurrent",
      "concurrency": 100,
      "wallClockMs": 3793.27,
      "timeToFirstReadyMs": 0,
      "iterations": [
        {
          "ttiMs": 0,
          "error": "create: upstream error"
        },
        {
          "ttiMs": 0,
          "error": "create: upstream error"
        },
        {
          "ttiMs": 0,
          "error": "create: upstream error"
        },
        {
          "ttiMs": 0,
          "error": "create: upstream error"
        },
        {
          "ttiMs": 0,
          "error": "create: upstream error"
        },
        {
          "ttiMs": 0,
          "error": "create: upstream error"
        },
        {
          "ttiMs": 0,
          "error": "create: upstream error"
        },
        {
          "ttiMs": 0,
          "error": "create: upstream error"
        },
        {
          "ttiMs": 0,
          "error": "create: upstream error"
        },
        {
          "ttiMs": 0,
          "error": "create: upstream error"
        },
        {
          "ttiMs": 0,
          "error": "create: upstream error"
        },
        {
          "ttiMs": 0,
          "error": "create: upstream error"
        },
        {
          "ttiMs": 0,
          "error": "create: upstream error"
        },
        {
          "ttiMs": 0,
          "error": "create: upstream error"
        },
        {
          "ttiMs": 0,
          "error": "create: upstream error"
        },
        {
          "ttiMs": 0,
          "error": "create: upstream error"
        },
        {
          "ttiMs": 0,
          "error": "create: upstream error"
        },
        {
          "ttiMs": 0,
          "error": "create: upstream error"
        },
        {
          "ttiMs": 0,
          "error": "create: upstream error"
        },
        {
          "ttiMs": 0,
          "error": "create: upstream error"
        },
        {
          "ttiMs": 0,
          "error": "create: upstream error"
        },
        {
          "ttiMs": 0,
          "error": "create: upstream error"
        },
        {
          "ttiMs": 0,
          "error": "create: upstream error"
        },
        {
          "ttiMs": 0,
          "error": "create: upstream error"
        },
        {
          "ttiMs": 0,
          "error": "create: upstream error"
        },
        {
          "ttiMs": 0,
          "error": "create: upstream error"
        },
        {
          "ttiMs": 0,
          "error": "create: upstream error"
        },
        {
          "ttiMs": 0,
          "error": "create: upstream error"
        },
        {
          "ttiMs": 0,
          "error": "create: upstream error"
        },
        {
          "ttiMs": 0,
          "error": "create: upstream error"
        },
        {
          "ttiMs": 0,
          "error": "create: upstream error"
        },
        {
          "ttiMs": 0,
          "error": "create: upstream error"
        },
        {
          "ttiMs": 0,
          "error": "create: upstream error"
        },
        {
          "ttiMs": 0,
          "error": "create: upstream error"
        },
        {
          "ttiMs": 0,
          "error": "create: upstream error"
        },
        {
          "ttiMs": 0,
          "error": "create: upstream error"
        },
        {
          "ttiMs": 0,
          "error": "create: upstream error"
        },
        {
          "ttiMs": 0,
          "error": "create: upstream error"
        },
        {
          "ttiMs": 0,
          "error": "create: upstream error"
        },
        {
          "ttiMs": 0,
          "error": "create: upstream error"
        },
        {
          "ttiMs": 0,
          "error": "create: upstream error"
        },
        {
          "ttiMs": 0,
          "error": "create: upstream error"
        },
        {
          "ttiMs": 0,
          "error": "create: upstream error"
        },
        {
          "ttiMs": 0,
          "error": "create: upstream error"
        },
        {
          "ttiMs": 0,
          "error": "create: upstream error"
        },
        {
          "ttiMs": 0,
          "error": "create: upstream error"
        },
        {
          "ttiMs": 0,
          "error": "create: upstream error"
        },
        {
          "ttiMs": 0,
          "error": "create: upstream error"
        },
        {
          "ttiMs": 0,
          "error": "create: upstream error"
        },
        {
          "ttiMs": 0,
          "error": "create: upstream error"
        },
        {
          "ttiMs": 0,
          "error": "create: upstream error"
        },
        {
          "ttiMs": 0,
          "error": "create: upstream error"
        },
        {
          "ttiMs": 0,
          "error": "create: upstream error"
        },
        {
          "ttiMs": 0,
          "error": "create: upstream error"
        },
        {
          "ttiMs": 0,
          "error": "create: upstream error"
        },
        {
          "ttiMs": 0,
          "error": "create: upstream error"
        },
        {
          "ttiMs": 0,
          "error": "create: upstream error"
        },
        {
          "ttiMs": 0,
          "error": "create: upstream error"
        },
        {
          "ttiMs": 0,
          "error": "create: upstream error"
        },
        {
          "ttiMs": 0,
          "error": "create: upstream error"
        },
        {
          "ttiMs": 0,
          "error": "create: upstream error"
        },
        {
          "ttiMs": 0,
          "error": "create: upstream error"
        },
        {
          "ttiMs": 0,
          "error": "create: upstream error"
        },
        {
          "ttiMs": 0,
          "error": "create: upstream error"
        },
        {
          "ttiMs": 0,
          "error": "create: upstream error"
        },
        {
          "ttiMs": 0,
          "error": "create: upstream error"
        },
        {
          "ttiMs": 0,
          "error": "create: upstream error"
        },
        {
          "ttiMs": 0,
          "error": "create: upstream error"
        },
        {
          "ttiMs": 0,
          "error": "create: upstream error"
        },
        {
          "ttiMs": 0,
          "error": "create: upstream error"
        },
        {
          "ttiMs": 0,
          "error": "create: upstream error"
        },
        {
          "ttiMs": 0,
          "error": "create: upstream error"
        },
        {
          "ttiMs": 0,
          "error": "create: upstream error"
        },
        {
          "ttiMs": 0,
          "error": "create: upstream error"
        },
        {
          "ttiMs": 0,
          "error": "create: upstream error"
        },
        {
          "ttiMs": 0,
          "error": "create: upstream error"
        },
        {
          "ttiMs": 0,
          "error": "create: upstream error"
        },
        {
          "ttiMs": 0,
          "error": "create: upstream error"
        },
        {
          "ttiMs": 0,
          "error": "create: upstream error"
        },
        {
          "ttiMs": 0,
          "error": "create: upstream error"
        },
        {
          "ttiMs": 0,
          "error": "create: upstream error"
        },
        {
          "ttiMs": 0,
          "error": "create: upstream error"
        },
        {
          "ttiMs": 0,
          "error": "create: upstream error"
        },
        {
          "ttiMs": 0,
          "error": "create: upstream error"
        },
        {
          "ttiMs": 0,
          "error": "create: upstream error"
        },
        {
          "ttiMs": 0,
          "error": "create: upstream error"
        },
        {
          "ttiMs": 0,
          "error": "create: upstream error"
        },
        {
          "ttiMs": 0,
          "error": "create: upstream error"
        },
        {
          "ttiMs": 0,
          "error": "create: upstream error"
        },
        {
          "ttiMs": 0,
          "error": "create: upstream error"
        },
        {
          "ttiMs": 0,
          "error": "create: upstream error"
        },
        {
          "ttiMs": 0,
          "error": "create: upstream error"
        },
        {
          "ttiMs": 0,
          "error": "create: upstream error"
        },
        {
          "ttiMs": 0,
          "error": "create: upstream error"
        },
        {
          "ttiMs": 0,
          "error": "create: upstream error"
        },
        {
          "ttiMs": 0,
          "error": "create: upstream error"
        },
        {
          "ttiMs": 0,
          "error": "create: upstream error"
        },
        {
          "ttiMs": 0,
          "error": "create: upstream error"
        },
        {
          "ttiMs": 0,
          "error": "create: upstream error"
        },
        {
          "ttiMs": 0,
          "error": "create: upstream error"
        }
      ],
      "summary": {
        "ttiMs": {
          "median": 0,
          "p95": 0,
          "p99": 0
        }
      },
      "compositeScore": 0,
      "successRate": 0
    }
  ]
}