{
  "version": "1.1",
  "timestamp": "2026-08-07T07:12:43.705Z",
  "environment": {
    "node": "v24.19.0",
    "platform": "linux",
    "arch": "x64"
  },
  "config": {
    "iterations": 0,
    "timeoutMs": 30000
  },
  "results": [
    {
      "provider": "aws-s3",
      "mode": "storage",
      "bucket": "",
      "fileSizeBytes": 4194304,
      "iterations": [],
      "summary": {
        "uploadMs": {
          "median": 0,
          "p95": 0,
          "p99": 0
        },
        "downloadMs": {
          "median": 0,
          "p95": 0,
          "p99": 0
        },
        "throughputMbps": {
          "median": 0,
          "p95": 0,
          "p99": 0
        }
      },
      "compositeScore": 0,
      "successRate": 0,
      "skipped": true,
      "skipReason": "Missing: AWS_ACCESS_KEY_ID, AWS_SECRET_ACCESS_KEY, S3_BUCKET"
    },
    {
      "provider": "azure-blob",
      "mode": "storage",
      "bucket": "",
      "fileSizeBytes": 4194304,
      "iterations": [],
      "summary": {
        "uploadMs": {
          "median": 0,
          "p95": 0,
          "p99": 0
        },
        "downloadMs": {
          "median": 0,
          "p95": 0,
          "p99": 0
        },
        "throughputMbps": {
          "median": 0,
          "p95": 0,
          "p99": 0
        }
      },
      "compositeScore": 0,
      "successRate": 0,
      "skipped": true,
      "skipReason": "Missing: AZURE_ACCOUNT_NAME, AZURE_ACCOUNT_KEY, AZURE_CONTAINER"
    },
    {
      "provider": "cloudflare-r2",
      "mode": "storage",
      "bucket": "",
      "fileSizeBytes": 4194304,
      "iterations": [],
      "summary": {
        "uploadMs": {
          "median": 0,
          "p95": 0,
          "p99": 0
        },
        "downloadMs": {
          "median": 0,
          "p95": 0,
          "p99": 0
        },
        "throughputMbps": {
          "median": 0,
          "p95": 0,
          "p99": 0
        }
      },
      "compositeScore": 0,
      "successRate": 0,
      "skipped": true,
      "skipReason": "Missing: R2_ACCESS_KEY_ID, R2_SECRET_ACCESS_KEY, R2_BUCKET, R2_ACCOUNT_ID"
    },
    {
      "provider": "gcs",
      "mode": "storage",
      "bucket": "",
      "fileSizeBytes": 4194304,
      "iterations": [],
      "summary": {
        "uploadMs": {
          "median": 0,
          "p95": 0,
          "p99": 0
        },
        "downloadMs": {
          "median": 0,
          "p95": 0,
          "p99": 0
        },
        "throughputMbps": {
          "median": 0,
          "p95": 0,
          "p99": 0
        }
      },
      "compositeScore": 0,
      "successRate": 0,
      "skipped": true,
      "skipReason": "Missing: GCS_PROJECT_ID, GCS_BUCKET, GCS_CLIENT_EMAIL, GCS_PRIVATE_KEY"
    },
    {
      "provider": "tigris",
      "mode": "storage",
      "bucket": "",
      "fileSizeBytes": 4194304,
      "iterations": [],
      "summary": {
        "uploadMs": {
          "median": 0,
          "p95": 0,
          "p99": 0
        },
        "downloadMs": {
          "median": 0,
          "p95": 0,
          "p99": 0
        },
        "throughputMbps": {
          "median": 0,
          "p95": 0,
          "p99": 0
        }
      },
      "compositeScore": 0,
      "successRate": 0,
      "skipped": true,
      "skipReason": "Missing: TIGRIS_STORAGE_ACCESS_KEY_ID, TIGRIS_STORAGE_SECRET_ACCESS_KEY, TIGRIS_STORAGE_BUCKET"
    },
    {
      "provider": "vercel-blob",
      "mode": "storage",
      "bucket": "benchmarks",
      "fileSizeBytes": 4194304,
      "iterations": [],
      "summary": {
        "uploadMs": {
          "median": 0,
          "p95": 0,
          "p99": 0
        },
        "downloadMs": {
          "median": 0,
          "p95": 0,
          "p99": 0
        },
        "throughputMbps": {
          "median": 0,
          "p95": 0,
          "p99": 0
        }
      },
      "compositeScore": 0,
      "successRate": 0,
      "skipped": true,
      "skipReason": "Missing: BLOB_READ_WRITE_TOKEN"
    }
  ]
}