{
  "version": "1.1",
  "timestamp": "2026-05-10T04:17:03.446Z",
  "environment": {
    "node": "v24.15.0",
    "platform": "linux",
    "arch": "x64"
  },
  "config": {
    "iterations": 100,
    "timeoutMs": 120000
  },
  "results": [
    {
      "provider": "fcspawn",
      "mode": "staggered",
      "concurrency": 100,
      "staggerDelayMs": 200,
      "wallClockMs": 20035,
      "timeToFirstReadyMs": 0,
      "rampProfile": [],
      "iterations": [
        {
          "ttiMs": 0,
          "error": "fetch failed"
        },
        {
          "ttiMs": 0,
          "error": "fetch failed"
        },
        {
          "ttiMs": 0,
          "error": "fetch failed"
        },
        {
          "ttiMs": 0,
          "error": "fetch failed"
        },
        {
          "ttiMs": 0,
          "error": "fetch failed"
        },
        {
          "ttiMs": 0,
          "error": "fetch failed"
        },
        {
          "ttiMs": 0,
          "error": "fetch failed"
        },
        {
          "ttiMs": 0,
          "error": "fetch failed"
        },
        {
          "ttiMs": 0,
          "error": "fetch failed"
        },
        {
          "ttiMs": 0,
          "error": "fetch failed"
        },
        {
          "ttiMs": 0,
          "error": "fetch failed"
        },
        {
          "ttiMs": 0,
          "error": "fetch failed"
        },
        {
          "ttiMs": 0,
          "error": "fetch failed"
        },
        {
          "ttiMs": 0,
          "error": "fetch failed"
        },
        {
          "ttiMs": 0,
          "error": "fetch failed"
        },
        {
          "ttiMs": 0,
          "error": "fetch failed"
        },
        {
          "ttiMs": 0,
          "error": "fetch failed"
        },
        {
          "ttiMs": 0,
          "error": "fetch failed"
        },
        {
          "ttiMs": 0,
          "error": "fetch failed"
        },
        {
          "ttiMs": 0,
          "error": "fetch failed"
        },
        {
          "ttiMs": 0,
          "error": "fetch failed"
        },
        {
          "ttiMs": 0,
          "error": "fetch failed"
        },
        {
          "ttiMs": 0,
          "error": "fetch failed"
        },
        {
          "ttiMs": 0,
          "error": "fetch failed"
        },
        {
          "ttiMs": 0,
          "error": "fetch failed"
        },
        {
          "ttiMs": 0,
          "error": "fetch failed"
        },
        {
          "ttiMs": 0,
          "error": "fetch failed"
        },
        {
          "ttiMs": 0,
          "error": "fetch failed"
        },
        {
          "ttiMs": 0,
          "error": "fetch failed"
        },
        {
          "ttiMs": 0,
          "error": "fetch failed"
        },
        {
          "ttiMs": 0,
          "error": "fetch failed"
        },
        {
          "ttiMs": 0,
          "error": "fetch failed"
        },
        {
          "ttiMs": 0,
          "error": "fetch failed"
        },
        {
          "ttiMs": 0,
          "error": "fetch failed"
        },
        {
          "ttiMs": 0,
          "error": "fetch failed"
        },
        {
          "ttiMs": 0,
          "error": "fetch failed"
        },
        {
          "ttiMs": 0,
          "error": "fetch failed"
        },
        {
          "ttiMs": 0,
          "error": "fetch failed"
        },
        {
          "ttiMs": 0,
          "error": "fetch failed"
        },
        {
          "ttiMs": 0,
          "error": "fetch failed"
        },
        {
          "ttiMs": 0,
          "error": "fetch failed"
        },
        {
          "ttiMs": 0,
          "error": "fetch failed"
        },
        {
          "ttiMs": 0,
          "error": "fetch failed"
        },
        {
          "ttiMs": 0,
          "error": "fetch failed"
        },
        {
          "ttiMs": 0,
          "error": "fetch failed"
        },
        {
          "ttiMs": 0,
          "error": "fetch failed"
        },
        {
          "ttiMs": 0,
          "error": "fetch failed"
        },
        {
          "ttiMs": 0,
          "error": "fetch failed"
        },
        {
          "ttiMs": 0,
          "error": "fetch failed"
        },
        {
          "ttiMs": 0,
          "error": "fetch failed"
        },
        {
          "ttiMs": 0,
          "error": "fetch failed"
        },
        {
          "ttiMs": 0,
          "error": "fetch failed"
        },
        {
          "ttiMs": 0,
          "error": "fetch failed"
        },
        {
          "ttiMs": 0,
          "error": "fetch failed"
        },
        {
          "ttiMs": 0,
          "error": "fetch failed"
        },
        {
          "ttiMs": 0,
          "error": "fetch failed"
        },
        {
          "ttiMs": 0,
          "error": "fetch failed"
        },
        {
          "ttiMs": 0,
          "error": "fetch failed"
        },
        {
          "ttiMs": 0,
          "error": "fetch failed"
        },
        {
          "ttiMs": 0,
          "error": "fetch failed"
        },
        {
          "ttiMs": 0,
          "error": "fetch failed"
        },
        {
          "ttiMs": 0,
          "error": "fetch failed"
        },
        {
          "ttiMs": 0,
          "error": "fetch failed"
        },
        {
          "ttiMs": 0,
          "error": "fetch failed"
        },
        {
          "ttiMs": 0,
          "error": "fetch failed"
        },
        {
          "ttiMs": 0,
          "error": "fetch failed"
        },
        {
          "ttiMs": 0,
          "error": "fetch failed"
        },
        {
          "ttiMs": 0,
          "error": "fetch failed"
        },
        {
          "ttiMs": 0,
          "error": "fetch failed"
        },
        {
          "ttiMs": 0,
          "error": "fetch failed"
        },
        {
          "ttiMs": 0,
          "error": "fetch failed"
        },
        {
          "ttiMs": 0,
          "error": "fetch failed"
        },
        {
          "ttiMs": 0,
          "error": "fetch failed"
        },
        {
          "ttiMs": 0,
          "error": "fetch failed"
        },
        {
          "ttiMs": 0,
          "error": "fetch failed"
        },
        {
          "ttiMs": 0,
          "error": "fetch failed"
        },
        {
          "ttiMs": 0,
          "error": "fetch failed"
        },
        {
          "ttiMs": 0,
          "error": "fetch failed"
        },
        {
          "ttiMs": 0,
          "error": "fetch failed"
        },
        {
          "ttiMs": 0,
          "error": "fetch failed"
        },
        {
          "ttiMs": 0,
          "error": "fetch failed"
        },
        {
          "ttiMs": 0,
          "error": "fetch failed"
        },
        {
          "ttiMs": 0,
          "error": "fetch failed"
        },
        {
          "ttiMs": 0,
          "error": "fetch failed"
        },
        {
          "ttiMs": 0,
          "error": "fetch failed"
        },
        {
          "ttiMs": 0,
          "error": "fetch failed"
        },
        {
          "ttiMs": 0,
          "error": "fetch failed"
        },
        {
          "ttiMs": 0,
          "error": "fetch failed"
        },
        {
          "ttiMs": 0,
          "error": "fetch failed"
        },
        {
          "ttiMs": 0,
          "error": "fetch failed"
        },
        {
          "ttiMs": 0,
          "error": "fetch failed"
        },
        {
          "ttiMs": 0,
          "error": "fetch failed"
        },
        {
          "ttiMs": 0,
          "error": "fetch failed"
        },
        {
          "ttiMs": 0,
          "error": "fetch failed"
        },
        {
          "ttiMs": 0,
          "error": "fetch failed"
        },
        {
          "ttiMs": 0,
          "error": "fetch failed"
        },
        {
          "ttiMs": 0,
          "error": "fetch failed"
        },
        {
          "ttiMs": 0,
          "error": "fetch failed"
        },
        {
          "ttiMs": 0,
          "error": "fetch failed"
        },
        {
          "ttiMs": 0,
          "error": "fetch failed"
        }
      ],
      "summary": {
        "ttiMs": {
          "median": 0,
          "p95": 0,
          "p99": 0
        }
      },
      "compositeScore": 0,
      "successRate": 0
    }
  ]
}