{
  "version": "1.0",
  "timestamp": "2026-07-22T14:24:41.970Z",
  "config": {
    "mode": "sandbox-dax"
  },
  "results": [
    {
      "provider": "createos",
      "mode": "sandbox-dax",
      "iterations": [
        {
          "totalMs": 0,
          "error": "Request timed out after 60000ms: POST /v1/sandboxes/sb-01ky53azrp66240wdmvagqdd4a/exec"
        }
      ],
      "summary": {
        "totalMs": {
          "median": 0,
          "p95": 0,
          "p99": 0
        },
        "prepareMs": {
          "median": 0,
          "p95": 0,
          "p99": 0
        },
        "bunDownloadMs": {
          "median": 0,
          "p95": 0,
          "p99": 0
        },
        "bunUnpackMs": {
          "median": 0,
          "p95": 0,
          "p99": 0
        },
        "cloneMs": {
          "median": 0,
          "p95": 0,
          "p99": 0
        },
        "installMs": {
          "median": 0,
          "p95": 0,
          "p99": 0
        },
        "typecheckMs": {
          "median": 0,
          "p95": 0,
          "p99": 0
        }
      },
      "successRate": 0
    }
  ]
}