{
  "version": "1.1",
  "timestamp": "2026-06-28T00:57:58.236Z",
  "environment": {
    "node": "v24.18.0",
    "platform": "linux",
    "arch": "x64"
  },
  "config": {
    "iterations": 100,
    "timeoutMs": 120000
  },
  "results": [
    {
      "provider": "fcspawn",
      "iterations": [
        {
          "ttiMs": 0,
          "error": "exec: internal error"
        },
        {
          "ttiMs": 609.07
        },
        {
          "ttiMs": 0,
          "error": "exec: internal error"
        },
        {
          "ttiMs": 429.95
        },
        {
          "ttiMs": 543.94
        },
        {
          "ttiMs": 405.52
        },
        {
          "ttiMs": 0,
          "error": "exec: internal error"
        },
        {
          "ttiMs": 500.45
        },
        {
          "ttiMs": 424.13
        },
        {
          "ttiMs": 540.15
        },
        {
          "ttiMs": 0,
          "error": "exec: internal error"
        },
        {
          "ttiMs": 597.94
        },
        {
          "ttiMs": 430.38
        },
        {
          "ttiMs": 492.38
        },
        {
          "ttiMs": 403.18
        },
        {
          "ttiMs": 0,
          "error": "exec: internal error"
        },
        {
          "ttiMs": 490.94
        },
        {
          "ttiMs": 415.29
        },
        {
          "ttiMs": 0,
          "error": "exec: internal error"
        },
        {
          "ttiMs": 415.44
        },
        {
          "ttiMs": 501.22
        },
        {
          "ttiMs": 401.83
        },
        {
          "ttiMs": 0,
          "error": "exec: internal error"
        },
        {
          "ttiMs": 413.63
        },
        {
          "ttiMs": 495.81
        },
        {
          "ttiMs": 416.9
        },
        {
          "ttiMs": 0,
          "error": "exec: internal error"
        },
        {
          "ttiMs": 595.65
        },
        {
          "ttiMs": 409
        },
        {
          "ttiMs": 0,
          "error": "exec: internal error"
        },
        {
          "ttiMs": 507.04
        },
        {
          "ttiMs": 402.01
        },
        {
          "ttiMs": 519.73
        },
        {
          "ttiMs": 410.72
        },
        {
          "ttiMs": 0,
          "error": "exec: internal error"
        },
        {
          "ttiMs": 547.38
        },
        {
          "ttiMs": 423.41
        },
        {
          "ttiMs": 0,
          "error": "exec: internal error"
        },
        {
          "ttiMs": 545.59
        },
        {
          "ttiMs": 422.54
        },
        {
          "ttiMs": 495.44
        },
        {
          "ttiMs": 409.57
        },
        {
          "ttiMs": 0,
          "error": "exec: internal error"
        },
        {
          "ttiMs": 420.59
        },
        {
          "ttiMs": 550.76
        },
        {
          "ttiMs": 0,
          "error": "exec: internal error"
        },
        {
          "ttiMs": 540.32
        },
        {
          "ttiMs": 411.19
        },
        {
          "ttiMs": 540.89
        },
        {
          "ttiMs": 0,
          "error": "exec: internal error"
        },
        {
          "ttiMs": 497.84
        },
        {
          "ttiMs": 405.08
        },
        {
          "ttiMs": 593.16
        },
        {
          "ttiMs": 0,
          "error": "exec: internal error"
        },
        {
          "ttiMs": 402.67
        },
        {
          "ttiMs": 544.34
        },
        {
          "ttiMs": 0,
          "error": "exec: internal error"
        },
        {
          "ttiMs": 424.47
        },
        {
          "ttiMs": 545.68
        },
        {
          "ttiMs": 445.05
        },
        {
          "ttiMs": 559.34
        },
        {
          "ttiMs": 0,
          "error": "exec: internal error"
        },
        {
          "ttiMs": 422.21
        },
        {
          "ttiMs": 492.74
        },
        {
          "ttiMs": 402.03
        },
        {
          "ttiMs": 0,
          "error": "exec: internal error"
        },
        {
          "ttiMs": 395.67
        },
        {
          "ttiMs": 534.56
        },
        {
          "ttiMs": 419.82
        },
        {
          "ttiMs": 0,
          "error": "exec: internal error"
        },
        {
          "ttiMs": 407.18
        },
        {
          "ttiMs": 545.06
        },
        {
          "ttiMs": 402.89
        },
        {
          "ttiMs": 0,
          "error": "exec: internal error"
        },
        {
          "ttiMs": 422.33
        },
        {
          "ttiMs": 548.79
        },
        {
          "ttiMs": 0,
          "error": "exec: internal error"
        },
        {
          "ttiMs": 540.44
        },
        {
          "ttiMs": 405.82
        },
        {
          "ttiMs": 486.07
        },
        {
          "ttiMs": 0,
          "error": "exec: internal error"
        },
        {
          "ttiMs": 410.86
        },
        {
          "ttiMs": 593.77
        },
        {
          "ttiMs": 0,
          "error": "exec: internal error"
        },
        {
          "ttiMs": 495.16
        },
        {
          "ttiMs": 412.8
        },
        {
          "ttiMs": 0,
          "error": "exec: internal error"
        },
        {
          "ttiMs": 544.65
        },
        {
          "ttiMs": 404.13
        },
        {
          "ttiMs": 0,
          "error": "exec: internal error"
        },
        {
          "ttiMs": 404.91
        },
        {
          "ttiMs": 568.03
        },
        {
          "ttiMs": 411.21
        },
        {
          "ttiMs": 0,
          "error": "exec: internal error"
        },
        {
          "ttiMs": 408.82
        },
        {
          "ttiMs": 590.26
        },
        {
          "ttiMs": 0,
          "error": "exec: internal error"
        },
        {
          "ttiMs": 494.35
        },
        {
          "ttiMs": 425.79
        },
        {
          "ttiMs": 0,
          "error": "exec: internal error"
        }
      ],
      "summary": {
        "ttiMs": {
          "median": 437.72,
          "p95": 568.03,
          "p99": 593.77
        }
      },
      "compositeScore": 68.45,
      "successRate": 0.72
    }
  ]
}