{
  "version": "1.1",
  "timestamp": "2026-07-22T15:35:52.733Z",
  "environment": {
    "node": "v24.18.0",
    "platform": "linux",
    "arch": "x64"
  },
  "config": {
    "iterations": 10,
    "timeoutMs": 120000
  },
  "results": [
    {
      "provider": "createos",
      "mode": "staggered",
      "concurrency": 10,
      "staggerDelayMs": 200,
      "wallClockMs": 1893.29,
      "timeToFirstReadyMs": 50.5,
      "rampProfile": [
        {
          "launchedAt": 0.01,
          "readyAt": 76.72,
          "ttiMs": 53.42
        },
        {
          "launchedAt": 201.31,
          "readyAt": 283.12,
          "ttiMs": 52.96
        },
        {
          "launchedAt": 401.53,
          "readyAt": 485.04,
          "ttiMs": 52.04
        },
        {
          "launchedAt": 601.57,
          "readyAt": 683.4,
          "ttiMs": 52.92
        },
        {
          "launchedAt": 802.14,
          "readyAt": 879.68,
          "ttiMs": 52.62
        },
        {
          "launchedAt": 1003.26,
          "readyAt": 1083.83,
          "ttiMs": 56.39
        },
        {
          "launchedAt": 1208.33,
          "readyAt": 1284.28,
          "ttiMs": 50.5
        },
        {
          "launchedAt": 1408.93,
          "readyAt": 1525.95,
          "ttiMs": 52.69
        },
        {
          "launchedAt": 1609.51,
          "readyAt": 1692.34,
          "ttiMs": 55.37
        },
        {
          "launchedAt": 1810.08,
          "readyAt": 1893.2,
          "ttiMs": 53.08
        }
      ],
      "iterations": [
        {
          "ttiMs": 53.42
        },
        {
          "ttiMs": 52.96
        },
        {
          "ttiMs": 52.04
        },
        {
          "ttiMs": 52.92
        },
        {
          "ttiMs": 52.62
        },
        {
          "ttiMs": 56.39
        },
        {
          "ttiMs": 50.5
        },
        {
          "ttiMs": 52.69
        },
        {
          "ttiMs": 55.37
        },
        {
          "ttiMs": 53.08
        }
      ],
      "summary": {
        "ttiMs": {
          "median": 52.94,
          "p95": 56.39,
          "p99": 56.39
        }
      },
      "compositeScore": 99.46,
      "successRate": 1
    }
  ]
}