{
  "version": "1.1",
  "timestamp": "2026-05-29T00:58:31.057Z",
  "environment": {
    "node": "v24.16.0",
    "platform": "linux",
    "arch": "x64"
  },
  "config": {
    "iterations": 100,
    "timeoutMs": 120000
  },
  "results": [
    {
      "provider": "fcspawn",
      "iterations": [
        {
          "ttiMs": 676.1
        },
        {
          "ttiMs": 551.68
        },
        {
          "ttiMs": 217.55
        },
        {
          "ttiMs": 203.69
        },
        {
          "ttiMs": 207.25
        },
        {
          "ttiMs": 494.16
        },
        {
          "ttiMs": 507.76
        },
        {
          "ttiMs": 483.55
        },
        {
          "ttiMs": 476.68
        },
        {
          "ttiMs": 196.53
        },
        {
          "ttiMs": 204.19
        },
        {
          "ttiMs": 207.13
        },
        {
          "ttiMs": 210.04
        },
        {
          "ttiMs": 203.99
        },
        {
          "ttiMs": 490.76
        },
        {
          "ttiMs": 492.99
        },
        {
          "ttiMs": 525.48
        },
        {
          "ttiMs": 479.68
        },
        {
          "ttiMs": 491.46
        },
        {
          "ttiMs": 505.94
        },
        {
          "ttiMs": 505.43
        },
        {
          "ttiMs": 522.15
        },
        {
          "ttiMs": 509.9
        },
        {
          "ttiMs": 474.32
        },
        {
          "ttiMs": 190.88
        },
        {
          "ttiMs": 204.46
        },
        {
          "ttiMs": 215.79
        },
        {
          "ttiMs": 244.3
        },
        {
          "ttiMs": 199.92
        },
        {
          "ttiMs": 201.68
        },
        {
          "ttiMs": 232.75
        },
        {
          "ttiMs": 221.02
        },
        {
          "ttiMs": 228.89
        },
        {
          "ttiMs": 497.88
        },
        {
          "ttiMs": 500.46
        },
        {
          "ttiMs": 516.03
        },
        {
          "ttiMs": 505.48
        },
        {
          "ttiMs": 499.08
        },
        {
          "ttiMs": 492.04
        },
        {
          "ttiMs": 514.86
        },
        {
          "ttiMs": 0,
          "error": "First command execution timed out"
        },
        {
          "ttiMs": 355.33
        },
        {
          "ttiMs": 201.73
        },
        {
          "ttiMs": 206.96
        },
        {
          "ttiMs": 509.77
        },
        {
          "ttiMs": 500.46
        },
        {
          "ttiMs": 509.65
        },
        {
          "ttiMs": 506.5
        },
        {
          "ttiMs": 218.2
        },
        {
          "ttiMs": 217.81
        },
        {
          "ttiMs": 197
        },
        {
          "ttiMs": 208.46
        },
        {
          "ttiMs": 196.73
        },
        {
          "ttiMs": 505.15
        },
        {
          "ttiMs": 556.89
        },
        {
          "ttiMs": 551.14
        },
        {
          "ttiMs": 496.61
        },
        {
          "ttiMs": 510.64
        },
        {
          "ttiMs": 478.04
        },
        {
          "ttiMs": 504.06
        },
        {
          "ttiMs": 510.49
        },
        {
          "ttiMs": 502.42
        },
        {
          "ttiMs": 694.8
        },
        {
          "ttiMs": 217.69
        },
        {
          "ttiMs": 195.21
        },
        {
          "ttiMs": 227.14
        },
        {
          "ttiMs": 213.88
        },
        {
          "ttiMs": 213.64
        },
        {
          "ttiMs": 198.43
        },
        {
          "ttiMs": 211.11
        },
        {
          "ttiMs": 232.46
        },
        {
          "ttiMs": 0,
          "error": "exec: {\"status\":\"fail\",\"data\":\"sandbox not found\"}"
        },
        {
          "ttiMs": 176.72
        },
        {
          "ttiMs": 200.74
        },
        {
          "ttiMs": 196.86
        },
        {
          "ttiMs": 209.29
        },
        {
          "ttiMs": 212.69
        },
        {
          "ttiMs": 222.98
        },
        {
          "ttiMs": 220.68
        },
        {
          "ttiMs": 201.12
        },
        {
          "ttiMs": 224.63
        },
        {
          "ttiMs": 215.79
        },
        {
          "ttiMs": 216.5
        },
        {
          "ttiMs": 211.33
        },
        {
          "ttiMs": 521.93
        },
        {
          "ttiMs": 499.38
        },
        {
          "ttiMs": 511.86
        },
        {
          "ttiMs": 518.21
        },
        {
          "ttiMs": 500.2
        },
        {
          "ttiMs": 502.7
        },
        {
          "ttiMs": 490.09
        },
        {
          "ttiMs": 529.82
        },
        {
          "ttiMs": 501.57
        },
        {
          "ttiMs": 502.17
        },
        {
          "ttiMs": 519.53
        },
        {
          "ttiMs": 505
        },
        {
          "ttiMs": 503.88
        },
        {
          "ttiMs": 502.67
        },
        {
          "ttiMs": 502.41
        },
        {
          "ttiMs": 491.16
        }
      ],
      "summary": {
        "ttiMs": {
          "median": 481.62,
          "p95": 521.93,
          "p99": 551.14
        }
      },
      "compositeScore": 93.08,
      "successRate": 0.98
    }
  ]
}